{
  "schema": "athena.module.manifest",
  "schemaVersion": "1.1",
  "id": "background-worker",
  "name": "Background Worker",
  "version": "1.0.0",
  "kind": "worker",
  "owner": "platform",
  "criticality": "medium",
  "runtimeRole": "background-worker",
  "sourcePaths": [
    "server/background-worker.js",
    "server/utils/backgroundWorker/",
    "server/utils/BackgroundWorkers/"
  ],
  "capabilities": [
    "maintenance",
    "cleanup",
    "recovery",
    "patrol"
  ],
  "routes": {
    "public": [],
    "internal": [
      "/health",
      "/snapshot"
    ]
  },
  "rpc": {
    "provides": [
      "background.execute",
      "module.describe",
      "module.self-test",
      "module.lifecycle.query",
      "module.drain",
      "module.quiesce",
      "module.resume"
    ],
    "consumes": [
      "coordination.lifecycle.event",
      "coordination.lifecycle.heartbeat",
      "crypto.forecast",
      "knowledge.ingest",
      "operations.ingest-batch"
    ]
  },
  "events": {
    "publishes": [
      "background.job.*",
      "module.lifecycle.*"
    ],
    "subscribes": [
      "background.requested"
    ]
  },
  "data": {
    "schemas": [
      "maintenance"
    ],
    "objectPrefixes": []
  },
  "security": {
    "serviceIdentity": "spiffe://athena/{environment}/background-worker",
    "keyDomains": [
      "data",
      "file",
      "agent"
    ],
    "allowedCallers": [
      "scheduler",
      "operations-plane",
      "coordination-plane"
    ],
    "failureMode": "isolated-degraded",
    "principalFreshnessMs": 30000
  },
  "deployment": {
    "image": "athena/background-worker",
    "healthPath": "/health",
    "readinessPath": "/snapshot",
    "drainPath": "/internal/drain",
    "availabilityTarget": 0.99,
    "reconnectP95Ms": 0
  },
  "dependsOn": [
    "authentication",
    "knowledge-ingest",
    "crypto-forecast",
    "infra:postgresql",
    "infra:nats"
  ],
  "domain": "platform-control",
  "responsibilities": [
    "maintenance",
    "cleanup",
    "recovery",
    "patrol"
  ],
  "nonResponsibilities": [
    "foreign-schema-writes",
    "cross-module-business-policy"
  ],
  "contracts": {
    "provides": [
      {
        "id": "background.execute",
        "version": "1.0",
        "callType": "Call",
        "requestSchema": "athena://contracts/background.execute/request/1.0",
        "responseSchema": "athena://contracts/background.execute/response/1.0",
        "errorCodes": [
          "contract_invalid",
          "deadline_exceeded",
          "caller_denied",
          "dependency_unavailable"
        ],
        "timeoutMs": 30000,
        "idempotency": "supported",
        "dataClassification": "internal"
      },
      {
        "id": "module.describe",
        "version": "1.0",
        "callType": "Query",
        "requestSchema": "athena://contracts/module.describe/request/1.0",
        "responseSchema": "athena://contracts/module.describe/response/1.0",
        "errorCodes": [
          "contract_invalid",
          "deadline_exceeded",
          "caller_denied",
          "dependency_unavailable"
        ],
        "timeoutMs": 30000,
        "idempotency": "none",
        "dataClassification": "internal"
      },
      {
        "id": "module.self-test",
        "version": "1.0",
        "callType": "Query",
        "requestSchema": "athena://contracts/module.self-test/request/1.0",
        "responseSchema": "athena://contracts/module.self-test/response/1.0",
        "errorCodes": [
          "contract_invalid",
          "deadline_exceeded",
          "caller_denied",
          "dependency_unavailable"
        ],
        "timeoutMs": 30000,
        "idempotency": "none",
        "dataClassification": "internal"
      },
      {
        "id": "module.lifecycle.query",
        "version": "1.0",
        "callType": "Query",
        "requestSchema": "athena://contracts/module.lifecycle.query/request/1.0",
        "responseSchema": "athena://contracts/module.lifecycle.query/response/1.0",
        "errorCodes": [
          "contract_invalid",
          "deadline_exceeded",
          "caller_denied",
          "dependency_unavailable"
        ],
        "timeoutMs": 30000,
        "idempotency": "none",
        "dataClassification": "internal"
      },
      {
        "id": "module.drain",
        "version": "1.0",
        "callType": "Command",
        "requestSchema": "athena://contracts/module.drain/request/1.0",
        "responseSchema": "athena://contracts/module.drain/response/1.0",
        "errorCodes": [
          "contract_invalid",
          "deadline_exceeded",
          "caller_denied",
          "dependency_unavailable"
        ],
        "timeoutMs": 30000,
        "idempotency": "required",
        "dataClassification": "confidential"
      },
      {
        "id": "module.quiesce",
        "version": "1.0",
        "callType": "Command",
        "requestSchema": "athena://contracts/module.quiesce/request/1.0",
        "responseSchema": "athena://contracts/module.quiesce/response/1.0",
        "errorCodes": [
          "contract_invalid",
          "deadline_exceeded",
          "caller_denied",
          "dependency_unavailable"
        ],
        "timeoutMs": 30000,
        "idempotency": "required",
        "dataClassification": "confidential"
      },
      {
        "id": "module.resume",
        "version": "1.0",
        "callType": "Command",
        "requestSchema": "athena://contracts/module.resume/request/1.0",
        "responseSchema": "athena://contracts/module.resume/response/1.0",
        "errorCodes": [
          "contract_invalid",
          "deadline_exceeded",
          "caller_denied",
          "dependency_unavailable"
        ],
        "timeoutMs": 30000,
        "idempotency": "required",
        "dataClassification": "confidential"
      }
    ],
    "consumes": [
      {
        "id": "coordination.lifecycle.event",
        "version": "1.0",
        "callType": "Command",
        "requestSchema": "athena://contracts/coordination.lifecycle.event/request/1.0",
        "responseSchema": "athena://contracts/coordination.lifecycle.event/response/1.0",
        "errorCodes": [
          "contract_invalid",
          "deadline_exceeded",
          "caller_denied",
          "dependency_unavailable"
        ],
        "timeoutMs": 30000,
        "idempotency": "required",
        "dataClassification": "internal"
      },
      {
        "id": "coordination.lifecycle.heartbeat",
        "version": "1.0",
        "callType": "Command",
        "requestSchema": "athena://contracts/coordination.lifecycle.heartbeat/request/1.0",
        "responseSchema": "athena://contracts/coordination.lifecycle.heartbeat/response/1.0",
        "errorCodes": [
          "contract_invalid",
          "deadline_exceeded",
          "caller_denied",
          "dependency_unavailable"
        ],
        "timeoutMs": 30000,
        "idempotency": "required",
        "dataClassification": "internal"
      },
      {
        "id": "crypto.forecast",
        "version": "1.0",
        "callType": "Call",
        "requestSchema": "athena://contracts/crypto.forecast/request/1.0",
        "responseSchema": "athena://contracts/crypto.forecast/response/1.0",
        "errorCodes": [
          "contract_invalid",
          "deadline_exceeded",
          "caller_denied",
          "dependency_unavailable"
        ],
        "timeoutMs": 30000,
        "idempotency": "supported",
        "dataClassification": "internal"
      },
      {
        "id": "knowledge.ingest",
        "version": "1.0",
        "callType": "Call",
        "requestSchema": "athena://contracts/knowledge.ingest/request/1.0",
        "responseSchema": "athena://contracts/knowledge.ingest/response/1.0",
        "errorCodes": [
          "contract_invalid",
          "deadline_exceeded",
          "caller_denied",
          "dependency_unavailable"
        ],
        "timeoutMs": 30000,
        "idempotency": "supported",
        "dataClassification": "internal"
      },
      {
        "id": "operations.ingest-batch",
        "version": "1.0",
        "callType": "Call",
        "requestSchema": "athena://contracts/operations.ingest-batch/request/1.0",
        "responseSchema": "athena://contracts/operations.ingest-batch/response/1.0",
        "errorCodes": [
          "contract_invalid",
          "deadline_exceeded",
          "caller_denied",
          "dependency_unavailable"
        ],
        "timeoutMs": 5000,
        "idempotency": "supported",
        "dataClassification": "internal"
      }
    ]
  },
  "ownership": {
    "dataSchemas": [
      "maintenance"
    ],
    "objectPrefixes": [],
    "keyDomains": [
      "data",
      "file",
      "agent"
    ],
    "configuration": [
      "runtime:background-worker"
    ],
    "runtimeState": [
      "module-instance:background-worker"
    ]
  },
  "coordination": {
    "centers": [
      "task",
      "recovery",
      "data"
    ],
    "acceptedCommands": [
      "module.drain",
      "module.quiesce",
      "module.resume"
    ],
    "aicpPolicy": {
      "defaultMode": "observe",
      "links": []
    }
  },
  "lifecycle": {
    "states": [
      "registered",
      "initializing",
      "ready",
      "degraded",
      "draining",
      "quiesced",
      "stopped",
      "failed"
    ],
    "hooks": [
      "initialize",
      "self-test",
      "ready",
      "checkpoint",
      "drain",
      "quiesce",
      "resume",
      "stop",
      "reconcile"
    ],
    "commands": [
      "module.drain",
      "module.quiesce",
      "module.resume"
    ],
    "heartbeatIntervalMs": 30000,
    "leaseTtlMs": 90000
  },
  "reliability": {
    "rtoMs": 180000,
    "rpoMs": 60000,
    "forbiddenDegradations": [
      "security-downgrade",
      "cross-account-data",
      "unsigned-control"
    ]
  }
}
